{
    "name": "ac_user",
    "pk": {
      "fields": [
        "ID"
      ]
    },
    "checks":[{
        "name":"",
        "condition":""
    }],
    "rules":["ALL","CREATE","READ","UPDATE","DELETE"],
    "fks": [
      {
        "fields": ["ID"],
        "pk_model": "AC_USER",
        "pk_fields": ["ID"],
        "name": ""
      }
    ],
    "fields": [
      {
        "name": "ID",
        "type": "integer",
        "size": 10,
        "digits": 6,
        "defaultValue": "10",
        "position": 0,
        "isNullable": true,
        "isAutoincrement": false,
        "isKey": true
      }
    ]
  }